{
    "$schema": "../../../../../../node_modules/@metalizzsas/nuster-typings/build/schemas/schema-translations.json",

    "containers": {

        "eff": {
            "name": "Effluents"
        },

        "resin": {
            "name": "Vernis"
        }
    },
    "profile": {
        "categories": {
            "vapors-extraction": "Extraction des vapeurs",
            "pulverization": "Pulvérisation",
            "uv-curing": "Cuisson UV",
            "inerting": "Inertage",
            "multilayer": "Multicouche",
            "motor": "Moteur de rotation"
        },
        "premade": {
            "sla": "Pièce 3D SLA / DLP"
        },
        "rows": {
            "interlayer-uvduration": "Durée cuisson UV entre les couche",
            "uv-power": "Puissance UV",
            "reverseEnabled": "Invertion moteur",
            "reverseTime": "Delai inversion sens moteur"
        }
    },
    "cycle": {
        "names": {
            "default": "Cycle de base smoothit"
        },
        "end_reasons": {
            "uv-cache-wrong": "Erreur position cache UV",
            "nozzle-cache-wrong": "Erreur position cache buse",
            "security-emergency-stop": "Boutton d'arret d'urgence déclenché",
            "security-nitrogen-sensor": "Pression d'azote trop basse",
            "security-cover-closed": "Couvercle ouvert",
            "security-resin#slot-sensor": "Pot de vernis manquant",
            "security-uv#overheat": "Surchauffe lampe UV"
        },
        "run_conditions": {
            "emergency-stop": "Statut bouton d'arret d'urgence",
            "nitrogen-sensor": "Pression d'azote",
            "cover-closed": "Couvercle fermé",
            "resin#slot-sensor": "Présence du pot de vernis",
            "uv#overheat": "Température de la lampe UV"
        },
        "steps": {
            "start": {
                "name": "Démarrage",
                "desc": "Préchauffe de la machine"
            },
            "pulverization": {
                "name": "Pulvérisation",
                "desc": "Application du vernis sur vos pièces."
            },
            "inerting": {
                "name": "Inertage",
                "desc": "Remplissage de la cuve d'azote pour améliorer la cuisson UV."
            },
            "uv-curing-interlayer": {
                "name": "Cuisson UV",
                "desc": "Durcissement du vernis UV."
            },
            "uv-curing": {
                "name": "Cuisson UV",
                "desc": "Durcissement du vernis UV."
            },
            "vapors-extraction": {
                "name": "Filtrations des vapeurs",
                "desc": "Filtrations des gazs et fines particules produites par le programme."
            }
        }
    },
    "gates": {
        "categories": {
            "motor": "Moteur de rotation",
            "uv": "Ultraviolet",
            "nozzle": "Buse",
            "resin": "Vernis"
        },
        "names": {
            "emergency-stop": "Bouton d'arret d'urgence",
            "nitrogen-sensor": "Pression d'azote",
            "cover-closed": "Couvercle fermé",
            
            "ventilation": "Extraction des vapeurs",
            "air-heater": "Rechauffeur d'air",
            "inerting": "Inertage",
            
            "resin#slot-sensor": "Resin container sensor",
            "resin#pressure": "Resin container pressure",
            
            "uv#sensor-open": "Cache UV Ouvert",
            "uv#sensor-closed": "Cache UV Fermé",
            "uv#overheat": "Surchauffe lampe UV",
            "uv#enable": "Lampe UV",
            "uv#ventil": "Ventilation lampe UV",
            "uv#power": "Puissance lampe UV",
            "uv#cache": "Cache lampe UV",
            
            "motor#direction": "Sens moteur",
            "motor#speed": "Vitesse moteur",
            
            "nozzle#sensor-open": "Cache buse ouver",
            "nozzle#sensor-closed": "Cache buse fermé",
            "nozzle#pulverization": "Pulvérization",
            "nozzle#cache": "Cache buse"
        }
    },

    "maintenance": {
        "tasks": {
            "smt-filter": {
                "name": "Filtre solvants",
                "desc": "Filtre de Smoothit permet de filtrer les solvants, particules et gazs produits par le programme."
            },
            "inner-cleaning": {
                "name": "Masques interne",
                "desc": "Les masque interne evite l'accumulation de vernis dans la cuve."
            },
            "uv-lamp": {
                "name": "Lampe UV",
                "desc": "La lampe UV permet de durcir le vernis de lissage présent sur vos pièces."
            }
        }
    },

    "toasts": {},
    "addons": {}
}