{
    "$schema": "../../../node_modules/@metalizzsas/nuster-typings/build/schemas/schema-translations.json",

    "containers": {

        "eff": {
            "name": "Effluents"
        },

        "resin": {
            "name": "Varnish"
        }
    },

    "profile": {
        "categories": {
            "vapors-extraction": "Vapors extraction",
            "pulverization": "Pulverization",
            "uv-curing": "UV curing",
            "inerting": "Inerting",
            "multilayer": "Multilayer",
            "motor": "Rotation Motor"
        },
        "premade": {
            "shiny-polyjet": "Shiny Polyjet",
            "shiny-resin": "Shiny SLA / DLP",

            "translucent-polyjet": "Translucent Polyjet",
            "translucent-resin": "Translucent SLA / DLP"
        },
        "rows": {
            "interlayer-uvduration": "UV Curing time between layers",
            "uv-power": "UV Power",
            "reverseEnabled": "Motor direction reverse",
            "reverseTime": "Motor reverser timer",
            "high-enabled": "High nozzle enabled",
            "low-enabled": "Low nozzle enabled"
        }
    },
    "cycle": {
        "names": {
            "default": "Base smoothit cycle"
        },
        "end_reasons": {
            "uv-cache-wrong": "UV Cache error",
            "nozzle-low-cache-wrong": "Nozzle Low Cache error",
            "nozzle-high-cache-wrong": "Nozzle High Cache error",
            "security-emergency-stop": "Emergency stop button pressed",
            "security-nitrogen-sensor": "Nitrogen pressure too low",
            "security-cover-closed": "Cover open",
            "security-resin#slot-sensor": "Vanish slot missing",
            "security-uv#overheat": "UV lamp overheat"
        },
        "run_conditions": {
            "emergency-stop": "Emergency stop button pressed",
            "nitrogen-sensor": "Nitrogen pressure too low",
            "cover-closed": "Cover open",
            "resin#slot-sensor": "Vanish slot missing",
            "uv#overheat": "UV lamp overheat"
        },
        "steps": {
            "start": {
                "name": "Start",
                "desc": "Preheating machine"
            },
            "pulverization": {
                "name": "Pulverization",
                "desc": "Applying varnish on your parts."
            },
            "inerting": {
                "name": "Inerting",
                "desc": "Filling the machine with nitrogen to ehance UV Curing."
            },
            "uv-curing-interlayer": {
                "name": "UV Curing",
                "desc": "Hardening the varnish on your parts."
            },
            "uv-curing": {
                "name": "UV Curing",
                "desc": "Hardening the varnish on your parts."
            },
            "vapors-extraction": {
                "name": "Vapors filtering",
                "desc": "Filtering gases and thin particules produced by the machine"
            }
        }
    },
    "gates": {
        "categories": {
            "motor": "Rotation Motor",
            "uv": "Ultraviolet",
            "nozzle-high": "Nozzle high",
            "nozzle-low": "Nozzle low",
            "resin": "Varnish"
        },
        "names": {
            "emergency-stop": "Emergency stop button",
            "air-sensor": "Air pressure sensor",
            "nitrogen-sensor": "Nitrogen pressure sensor",
            "cover-closed": "Cover closed",
            "eff-container-sensor": "Effluents container sensor",
            
            "ventilation": "Vapors extraction",
            "ventilation-valve": "3 Way ventilation valve",
            "air-heater": "Air heater",
            "inerting": "Inerting",

            "levels#eff-n": "Effluents limit",
            "resin#slot-sensor": "Varnish container sensor",
            "resin#pressure": "Varnish container pressure",
            
            "uv#sensor-open": "UV cache open",
            "uv#sensor-closed": "UV cache closed",
            "uv#overheat": "UV overheat security",
            "uv#enable": "UV lamp",
            "uv#ventil": "UV lamp ventilation",
            "uv#power": "UV lamp power",
            "uv#cache": "UV lamp cache",
            
            "motor#direction": "Motor direction",
            "motor#speed": "Motor speed",
            
            "nozzle-high#sensor-open": "Nozzle high cache open",
            "nozzle-high#sensor-closed": "Nozzle high cache closed",
            "nozzle-high#pulverization": "Nozzle high pulverization",
            "nozzle-high#cache": "Nozzle high cache",

            "nozzle-low#sensor-open": "Nozzle low cache open",
            "nozzle-low#sensor-closed": "Nozzle low cache closed",
            "nozzle-low#pulverization": "Nozzle low pulverization",
            "nozzle-low#cache": "Nozzle low cache"
        }
    },

    "maintenance": {
        "tasks": {
            "smt-filter": {
                "name": "Filter",
                "desc": "Smoothit filter filters all coating solvants produced by the coating done inside the machine."
            },
            "inner-cleaning": {
                "name": "Inner",
                "desc": "The inner layer masks the machine to avoid vanish accumulation on the cuve."
            },
            "uv-lamp": {
                "name": "UV Lamp",
                "desc": "UV Lamp is used to harden varnish on top of your part."
            }
        }
    },

    "toasts": {},
    "addons": {}
}