{
    "$schema": "../../../node_modules/@metalizzsas/nuster-typings/build/schemas/schema-translations.json",

    "containers": {

        "resin": {
            "name": "Vernis",
            "actions": {
                "load": "Charger le vernis",
                "unload": "Retirer le vernins"
            }
        },

        "eff": {
            "name": "Effluents"
        },

        "eff-water": {
            "name": "Effluents rideau d'eau"
        }
    },

    "profile": {
        "categories": {
            "vapors-extraction": "Extraction des vapeurs",
            "pulverization": "Pulvérisation",
            "uv-curing": "Cuisson UV",
            "inerting": "Inertage",
            "multilayer": "Multicouche",
            "motor": "Moteur de rotation"
        },
        "premade": {
            "shiny": "Brillant",
            "translucent": "Transparent"
        },
        "rows": {
            "sprayOn": "Temps de spray (on)",
            "sprayOff": "Temps de repos spray (off)",
            "sprayCount": "Nombre de sprays",
            "interlayer-uvduration": "Durée cuisson uv entre les couches",
            "uv-power": "Puissance UV",
            "reverseEnabled": "Invertion moteur",
            "reverseTime": "Motor reverser timer",
            "high-enabled": "Buse haut activée",
            "low-enabled": "Buse bas activée",
            "aerosol-cleanup-time": "Temps d'évacuation des aerosols"
        }
    },

    "cycle": {
        "names": {
            "default": "Cycle de base smoothit"
        },
        "end_reasons": {
            "uv-cache-wrong": "Erreur position cache UV",
            "nozzle-low-cache-wrong": "Erreur position cache buse bas",
            "nozzle-high-cache-wrong": "Erreur position cache buse haut",
            "security-emergency-stop": "Boutton d'arret d'urgence déclenché",
            "security-nitrogen-sensor": "Pression d'azote trop basse",
            "security-cover-closed": "Couvercle ouvert",
            "security-resin#slot-sensor": "Pot de vernis manquant",
            "security-uv#overheat": "Surchauffe lampe UV"
        },
        "run_conditions": {
            "emergency-stop": "Statut bouton d'arret d'urgence",
            "nitrogen-sensor": "Pression d'azote",
            "cover-closed": "Couvercle fermé",
            "resin#slot-sensor": "Présence du pot de vernis",
            "uv#overheat": "Température de la lampe UV"
        },
        "steps": {
            "start": {
                "name": "Démarrage",
                "desc": "Préchauffe de la machine"
            },
            "pulverization": {
                "name": "Pulvérisation",
                "desc": "Application du vernis sur vos pièces."
            },
            "inerting": {
                "name": "Inertage",
                "desc": "Remplissage de la cuve d'azote pour améliorer la cuisson UV."
            },
            "uv-curing-interlayer": {
                "name": "Cuisson UV",
                "desc": "Durcissement du vernis UV."
            },
            "uv-curing": {
                "name": "Cuisson UV",
                "desc": "Durcissement du vernis UV."
            },
            "vapors-extraction": {
                "name": "Filtrations des vapeurs",
                "desc": "Filtrations des gazs et fines particules produites par le programme."
            }
        }
    },

    "gates": {
        "categories": {
            "motor": "Moteur de rotation",
            "uv": "Ultraviolet",
            "nozzle-high": "Buse haut",
            "nozzle-low": "Buse bas",
            "resin": "Vernis"
        },
        "names": {
            "emergency-stop": "Bouton d'arret d'urgence",
            "nitrogen-sensor": "Pression d'azote",
            "cover-closed": "Couvercle fermé",
            
            "ventilation": "Extraction des vapeurs",
            "ventilation-valve": "Vanne 3 voies ventilation",
            "water-slide-pump": "Pompe rideau d'eau",
            "inerting": "Inertage",

            "resin#slot-sensor": "Présence du pot de vernis",
            "resin#pressure": "Pression pot de vernis",
            
            "uv#sensor-open": "Cache UV over",
            "uv#sensor-closed": "Cache UV fermé",
            "uv#overheat": "Défaut température lampe UV",
            "uv#enable": "Lampe UV",
            "uv#power": "Puissance lampe UV",
            "uv#cache": "Cache lampe UV",
            
            "motor#direction": "Sens moteur",
            "motor#speed": "Vitesse moteur",
            
            "nozzle-high#sensor-open": "Cache ouvert buse haut",
            "nozzle-high#sensor-closed": "Cache fermé buse haut",
            "nozzle-high#pulverization": "Pulvérisation buse haut",
            "nozzle-high#cache": "Cache buse haut",

            "nozzle-low#sensor-open": "Cache ouvert buse bas",
            "nozzle-low#sensor-closed": "Cache fermé buse bas",
            "nozzle-low#pulverization": "Pulvérisation buse bas",
            "nozzle-low#cache": "Cache buse bas"
        }
    },

    "maintenance": {
        "tasks": {
            "inner-cleaning": {
                "name": "Masque interne",
                "desc": "Le masque interne evite l'accumulation de vernis dans la cuve."
            },
            "eff-container-varnish": {
                "name": "Conteneur de vernis",
                "desc": "Ce conteneur récupère les résidus de vernis après la pulvérisation."
            },
            "eff-container-water": {
                "name": "Conteneur d'eau & vernis",
                "desc": "Ce conteneur récupère les résidus de vernis restant a l'aide d'un rideau d'eau."
            },
            "smt-filter": {
                "name": "Filtre solvants",
                "desc": "Filtre de Smoothit permet de filtrer les solvants, particules et gazs produits par le programme."
            },
            "uv-lamp": {
                "name": "Lampe UV",
                "desc": "La lampe UV permet de durcir le vernis."
            }
        }
    },
    "toasts": {},
    "addons": {}
}